vote,comment
12,امور معروفة فاغلبية المقاولات الفرنسية و الاسبانية توجد في المغرب و تشغل اعدادا كبيرة فادا كانت ترغب في العمال فلن ترحل اروبا مشاريعها الى دول خارج الاتحاد الاروبي فكيف ستقبل عندها كسلاء يقتسمون الخبزة معها و زايدينها بالفهامات و كم من واحد اعتمد على احد افراد عاءلته و بعد مدة سيقول له الباب الحباب مصاب نتكافافا غير مع راسي
25,Au numéro 7لتصحيح فقط فرنسا لم تستعمر المغرب أبدا بل ملوككم من طلب الحماية منها
8,اللهم قطران بلادي ولا عسل البلدان. ما عرفتش علاش أغلبية المغاربة مهووسون بأوروبا وبكل ما هو أجنبي. حتى المغاربة الدين يعيشون في المغرب وخصوصا الطبقة الراقية يعيشون على الطريقة الأوروبية ويتكلمون لغات أجنبية مع أطفالهم ولا يرضون بلغتهم الأم ومنهم من يصل بهم الأمر احتقار كل من هو مغربي حر يعتز بمغربيته وبلغته ويتصرف بطريقة مغربية قحة . العنصرية نعيشها حتى في بلدنا السعيد مع بعضنا البعض في الإدارات العمومية وداخل الشركات والمصحات والأسواق الممتازة وفي كل مكان بحيث نعطي الاسبقية و الأهمية للدين يتكلمون بالفرنسية وشكلهم يشبه الانسان الأوروبي. هده الحقيقة المرة مع الأسف. المغربي الدي ينتمي الى الطبقة المتوسطة والفقيرة ليس له مكان ولا يرحب به لا داخل المغرب ولا خارجه.
-2,ومع المنبر الورقي ذاته الذي نشر أن المديرية العامة للأمن الوطني ترفض مرشحين نجحوا في مباراة الأمن، نظرا لمخالفتهم الشروط الجديدة التي وضعتها مديرية الحموشي خلال المباريات الأخيرة التي نظمت لولوج صفوف الأمن.لم افهم شيء في هدا الوطن لي فهم افهمني مافهمت والوا
9,اللي مبغاش يفهموه بعض أبناء جلدتنا ان أوروبا و الشعوب الأوروبية لا تريد ناس كسالى ناس اميبن جهلاء بالتحضر لا يريدون السير آلى الإمام بالعلم والمعرفة ة العمل نظافة احترام القانون احترام عادات وتقاليد الأوربيين من حرية ديمقراطية حرية الأشخاص عدم السرقة التسول الوسخ الكسل التحرش الخمر و المخدرات العربدة و صداع الرأس، هذه الأمور كلها توحد في عدد كبير من أبناء جلدتنا للأسف تشويه سمعة الشعب ا
0,إلى المعلق 30 Massinissaدائما للتصحيح.. نعم فرنسا دخلت المغرب من أجل الحماية لأن المغرب كان مستهدفا من طرف انجلترا و أمريكا و فرنسا.فاختار المغرب حماية فرنسا لكنها بعدما أحكمت قبضتها على جميع مناطق المغرب غيرت طريقتها و أصبحت مستعمرة للمغرب و الدليل أنها اخذت تخصم عدة مناطق مغربية و تضيفها للجزائر الفرنسية ظنا منها بأنها ستبقى تحكم الجزائر إلى الأبد.
12,الوظيفة او الاجرة او الكسل لن تنفعك لا في المغرب و لا باروبا او غيرها و كما قال الكاتب كيوساميالوظيفة يدخلها الفاشلون فادا اردت ان تصبح سعيدا و غنيا فلا تدخل للمدرسةيقصد مزاولة اعمال حرة و فعلا اغلبية الاثرياء الدين كسبوا بالحلال كانوا اميين او ورثوا ثرواتهم من اباءهم الاميين و الطامة فكم من متعلم بدر كل الاموال التي ورثها من ابيه و في الخارج اعطاها لاسياده
4,كل التعاليق انصبت على الهجرة و لا احد تكلم عن المتسببين في هذه الهجرة.اعني هنا البرلمانيان عن مراكش الذين و الله اعلم يحاكمان بتهمة الاختلاس و تبديد اموال الشعب لكن هذه المحاكمة ليست سوى فصل من المسرحية المعهودة سوف يخرجون بالبراءة مع كلمة بالصحة و الراحة و سمحوا لينا على الازعاج.
-6,كل المهاجرين يجمعون الاموال ويرجعون بلدهم الاصل الا المغاربة يدقون الاوتاد ويطمعون ف كل سئ ولا يرجعون الى بلدهم الا ف صندوق الجوع والنوع .ليس لديهم اي نية لنفع بلدهم باي شئ ويطلبون كل شئ
-1,"فاليهدروا اموال التى تنزع من المواطن ضلما .. رغما منه هذه القناة لايستفيد منها المواطن بشئ يفيده بل العكس ..أزمة ""دوزيم"" المالية، التي ما فتئت تلوح بها خلال الفترة الأخيرة، تمثلت في صور لسيارات فارهة تحمل ""لوغو"" القناة الثانية، بعدد من ربوع المملكة وخارجها، إضافة إلى مقطع فيديو تناوله رواد مواقع التواصل الاجتماعي وصوره أحد المغاربة المقيمين بالخارج تظهر فيه سيارة من ماركة فارهة عليها شعار القناة الثانية من أمام مكان الحلبة التي شهدت نزالا بين الملاكم المغربي بدر هاري وبين الهولندي ريكو بهولندا."
6,قبل الكلام على الهجرة علينا أن نغوص فيمن كان سببًا في هذه الهجرة فالحسن الثاني رحمة الله عليه كان أول من أعطى الضوء الأخضر لساكنة الريف لمغادرة التراب الوطني لانه كان يعلم مسبقا أن العاصفة ستبدأ من الريف ولهذا سمح لهم بمغادرة التراب الوطني بدون إعاقات عندما كان الجواز الأخضر لا يعطى إلا لفئة قليلة جدا نصف الريف هاجر الى الدول الغربية وكان الكل يخطط أن يصلح حاله المادي ويرجع الى الوطن الأم لكن عندما إستفحل الفساد في المغرب الكل راجع ما كان في مخيلته واستقر في بلد الهجرة وتبعه أبناءه وهناك من قضى نحبه وهناك من ينتظر إنا أعيش في هولندا 30 سنةً ولم ولن أندم على السنين التي قضيتها هنا ولم ولن أفكر يوما في الرجوع الى المغرب لأنني تعلمت شيء واحدًا وهو أنني بشر كمثل البشر عندما كنت أعيش في المغرب يتيمًا لا أحد كان ينظر لحالي وعائلتي حتى المدارس كانت ترفضني فكيف لي أن أبكي على بلد هو ليس لي وأنا ليس له
3,الأذكياء هاجرو واستغلو وقتهم في العمل الجاد وفي ضرف عشر سنوات عادو الى بلادهم وقامو باستغلال رأس مالهم في بلادهم أغلبهم نجحو ومنهم من اصبح من التجار الكبار ولا يذهبون الى اروبا الى سا ئحون رؤوسهم مرفوعه معززون ومكرمون. اما عكس الاذكياء هاجرو وقامو بنهج طريق العربده وضاعو شبابهم في الملاهي ليليه. الخمور الدعاره الخ...والان شابو واصبحو عاجزين العوده الى بلادهم وما عليهم الا الخنوع وقبول المذله. وهناك فئه ثالثه بالرغم من امتلاكها الامكانيات للعوده الى بلادهم. الا انهم يفضلون العيش هناك وتراهم اغلبيتهم يبيعون ما اهمله السكان في حاويات القمامه في الاسواق العشوائية لان معنى الكرامه وعزه النفس لا يعرفون معناهم اصلا.
0,هاد شي ، غير مسرحية سياسية ،والهدف منها ، لا يعلمه إلا الله و المخطيطين لهاد الهجرة بكثافة.
225,الحمد لله منين تفكرتهم كان تفكيري كلو معهم الله يرجعهم على خير ان شاء الله والله يحفظ المسلمين من هذا الوباء القاتل يارب
115,كيفاش دايرة هاد الدراسة فالصين ؟؟؟؟ على العموم الله يشوف من حالهم ويرجعوا سالمين لبلادهم وعائلتهم
219,بادرة طيبة من الملك محمد السادس اتمنى عودتهم إلى أهلهم بصحة وسلامة
-308,غدين تجيبو 100 للقضاء على 40 مليون أم سوف تتكفلو بعلاجهم قبل إدخالهم؟؟؟
183,شكرا جلالة الملك على هذه الالتفاتة الابوية وشكرا الشعب المغربي على تعاطفه مع ابنائنا ..لن يقدرها إلا الآباء الذين يحاصر الداء أبناءهم في دولة الصين 
60,مبادرة طيبة من راعي البلاد و العباد ،جزاكم الله خير الجزاء على هذه الإلتفاتة الطيبة و الغيرة على ولاد المغرب ، نرجو منكم إلتفاتة أخرى إلى أبناء الريف المغربي ،القابعين في سجون المملكة الشريفة حتى يتم طي هذا الملف إن شاء الله تعالى و الإنطلاق بدولتنا الحبيبة في إطار مشروع تنموي جديد يحقق للشعب المغربي الأصيل العيش الكريم في إطار عدالة إجتماعية و تعليم و صحة إن شاء الله تعالى
70,"الحمد لله اوليدات مغاربة صغار البارح دارو لايف يطلبون المساعدة خصوصا ان مدينتهم كانت محاصرة و سلطات القنصلية بقيت مكتوفة الايدي كون المدينة محاصرة مما حال دون ايصال المؤونة للطلبة المحاصرين , لكن ربما تدخل الملك سيمكنهم من الرجوع الي البلد لان الاوضاع سايرة للاسوء و نرجو من الله ان يوصلهم بخير و ندعو مع الشعب الصيني ليتغلب علي هذه الكارتة في اقرب الاجال اللهم اننا لا نسالك القدر ولكن نسالك اللطف فيه."
97,أتمنى أن يتم تعقيم الطائرة بعد ذلك والحجر الصحي على كل القادمين من الصين على تلك الطائرة حتى يتم محو الشك باليقين من عدم اصابتهم بالفيروس، وهذا كله لتفادي الكارثةهذه اجرائات عادية تقوم بها كل الدول، سنرى هل سيتبع المغرب هذه الإجراءات.
43,الله ينصر الملك ويحفظه لشعبه اتمنى للطلبة ان يعودوا سالمين الى اهلهمالصينيين يأكلون وجبات غريبة كالخفاش وهذا من أسباب ظهور الفيروسنسأل الله السلامة والعافية
53,زعما الملك من هاد الناحية معندك متسالو كيشفي الغليل الطلبة المغاربة لي حاصلين فالصين كيموتو بالجوع على حق لمحالات ووسائل النقل وكولشي حابس ولي خرج كيتعاقب ب 7 سنين د الحبس ودارو فيديوهات باش السلطات الدبلوماسية المغربية تتحرك وتردهوم للمغرب بحال كاع الدول لي رجعو المواطنين نتاعهوم وصافطو ليهوم طائرات مدنية خاصة وبعض الأحيان عسكرية كاع إلا المغرب الطمأنة ومتخافوش مكاين والو درنا رقم أخضر وكذا وكذا غا الهدرة دالنعاس حتى كيتدخل الملك شخصيا وهادي تحسب له كولشي كينوض يتجارا وخص المسؤولين ميبقاوش يتسناو الملك وخدمو كل يدير خدمتو اصاحبي لبغينا البلاد تزيد للقدام + حتى المغاربة لحاصللين فليبيا شحال هادا مدارو والو معاهوم حتى تدخل الملك ...
-40,أتمنى أن يأمر جلالته بترحيلي من المغرب حبذا إلى فرنسا أو ألمانيا أو كندا أو بريطانيا فأنا أعيش منذ سنوات في البطالة رغم حصولي على الإجازة في الإقتصاد ... و في حالة تم ذلك سأكون أكثر سعادة و سأحس كأنني ولدت من جديد ...
27,مبادرة جيدة من ملك البلاد.نتمى ان تتبعها مبادرات اخرى لارجاع القاصرين المتشردين في اوروربا.الرعاية بالمنكوبين في الجبال المغربية الذين يعانون في صمت من البرد والجوع والمرض.اطلاق سراح جميع المعتقلين من حراك الريف وزاكورة وجرادة والصحفيون والحقوقيون. وهناك ملفات اخرى تستحق الحل كالسطور على املاك الغير والفساد الاداري والمالي وربط المسؤلية بالمحاسبة.
27,الرجولة والقرارات الصائبة والمفرحة حتى نحس أننا مواطنين وهناك من يهتم بنا في بقاع العالم أسيدي الله إحفظك وخلي ليك الصحة أما كون جات على السي العثماني كون رسل معاربة لالصين بدلا من إرجاعهم
28,تدخل سيدنا نصره الله وايده في محله!!! رؤوف بأبناءه وهذا كان متوقع من ملك لا يبخل على أبناءه بالرظى والعطف!!! حب متبادل من ملك لشعب وفي وسنبقى داءما أوفياء للعرش العلوي الشريف تحت شعار.الله.الوطن.الملك!!!!
20,نحبك في الله ياملكنا محمد السادس.نخبك من اعماقنا ياملكنا محمد السادس.من ينقذ ابناءك المهاجرين بالصين سوى انتم جلالة الملك.والله الا دمعت عيني منين قريت الخبر.غادي نقول كيما ديما.ملكنا محمد السادس الله يحفظو وينصرو ويحفظ ليه الميمة لي ولداتو.
14,حفظك الله وأطال في عمرك وأدام الله عليك بالصحة والعافية. نثمن هذه الإلتفاثة المولوية من أجل إخواننا المقيمين في الصين، وحفظ الله بلدنا من كل مكروه إنه سميع الدعاء.
15,قرار سديد لجلالة الملك حفظه الله ، و نرجو أن تُتخذ الوسائل اللازمة من أجل معالجتهم مع اتخاذ السبل الكافية لعدم نقل العدوى ، حرس الله بلادنا من هذا الداء و سائر بلاد المسلمين
21,الحمد أخيرا جاء القرار الصائب الذي كنت أنتظره وينتظره كل المغاربة،فملك البلاد وبحنكته وطيبة قلبه أمر بعودة المواطنين العالقين في المدينة المنكوبة،واما الذين كنا نعول عليهم وهم من يسيرون مقاليد البلاد بقوا يتفرجون ولن يتخذوا أي قرار في هذا الشأن (أعضاء الحكومة)المعول عليها ،ولكن وكما يعلم كل مواطن مغربي فالمسير الوحيد لهذا البلد و حاميها هو الملك محمد السادس حفظه الله،ونتمنى لإخواننا أن ينجيهم الله من هذا المرض الخبيث وكل إنسان على وجه هذه الأرض.....
11,قرار جيد يجب أن ينقذ مواطنينا نتمنى أن يعودوا الطلاب بأمن وسلامة الى وطنهم بخير وعلى خيرBonne décision faut sauver nos concitoyens là ou ils se trouvent et préparé nos personnels médicale Confrontations à cette épidémie
8,نامل من الحكومة بالتعاون مع منظمة الصحة الدولي وبالتنسيق فيما بينهم حول إيجاد مصلا طبيا باسرع وقت ممكن حتى لا يتفشى هذا المرض الوبائي وتعليم الأسرة على أهمية النظافة في كل المجتمع يساهم في تعزيز الوقاية من هذا الآفة لخطيرة
0,هد الفروس لا يتحمل مناخ شمال افريقيا انه يموت قبل وصوله الينا الحمد لله مناخنا جيد
9,شكرا جزيلا مولاي انك بحق بطل المبادرات البنائة والشجاعة انقاد رعايا جلالتكم من محنتهم في الصين يعتبر شيء متالي ومتمييز أنكم بحق تهتمون بالمواطن المغربي في كل بقاع العالم مولاي حفظك الله ورعاك وجعل في الصالحات ذكراك واعانك وسدد خطاك وأقر عينك بولي العهد المحبوب مولاي الحسن وشد أزركم بجميع أفراد الأسرة الملكية الشريفة والشعب المغربي والحمد لله والصلاة والسلام على المصطفى الأمين وعلى آله وصحبه ومن والاه
8,شكرا لجلالة الملك على الالتفات لابناء الشعب وجلب الجمل بما حمل لاستثمار الفيروس في المغرب للقضاء على البطالة وتشجيع المصحات الخاصة ولما لا انتاج اعشاب طبية لتخفيف الاعراض وتصديرها لاسبايا والمانيا والكويت وفرنسا وامريكا ... لجلب العملة
-28,علاش كاينين البلايص في الصبيطارات؟ علاش كانينين الصبيطارات في المغرب؟واش عرفتوا علاش المغاربة كيتسنوا خارج المطارات لوداع او استقبال المسافرين؟ علاحقيتاش المخزن خايف عليهوم، باش ميتعاداوش مع المسافرين لي داخلين المغرب! اللهم يتعاداو الحيوط و الزليج و الكراسي ديال المطار في الداخل او الفيروس يخرج من المطار! الله يرحمنا! آمين!
17,مافهمتش لاش كاتصلاح السفارة و لاش كاين شي حد سميتو وزير خارجية؟؟ لاش ديما كايتسناو الملك؟؟ و تصوروا كون كان مريض مثلا؟؟ غايخليوهوم يموتوا؟؟
9,التفاتة موفقة، و في الوقت المناسب، اتمنى ان تطبق التعليمات حرفيا، و ااسف لنعدام روح المبادرة لدى السياسيين عامة، ديما لي حصل الى ماتفكروش سيدنا كيبقا حاصل
12,عند عودتهم وجب وضعهم في حجر صحي إحتياطي لمدة 14 يوما على الأقل . مع تعقيم الطائرة التي أقلتهم . لأن الفيروس قد تطور عن سابقه واصبح يصيب عددا أكبر من الضحايا ولا تضهر علامة الإصابة إلا بعد اسبوع من حضانة الفيروس . وخلال هذه الفترة قد يكون المصاب نقل الفيروس لمئات الأشخاص وهو لا يعلم باصابته .ويجب منعهم من التواصل المباشر مع عائلاتهم خلال مدة الحجر الصحي الإحتياطي .كما يجب اجراء فحوصات شاملة على الوافدين لمطارات المملكة . لقد أصبحت الفيروسات أكثر تطورا وذكاءا وأكثر مقاومة للمضادات الحيوية . ومستقبلا سيلقى أكثر من نصف البشر حتقهم بسبب الفيروسات . لأنها ستكون السبب الأول في انقراضنا في النهاية .نحن ندفع ثمن العولمة التي فتحت الطريق لانتشار الأمراض والفيروسات على نطاق واسع جدا . قبل العولمة لم يكن ليحدث ما نعيشه من فوضى وموت حاليا .
11,34 مغربي حنوبي/: أتدري لمادا يبنى مستشفى في الصين في عشرة أيام..؟ هناك فائض في اليد العاملة الرخيصة والسكان مليار نسمة وهم مجدون في العمل ولا ينتظرون تفريق الريع مثل بعض القوم عند الجيران وحمادات تندوف.. ولسد الخصاص عندهم يستغلون حتى الكلاب والقطط في تغددتهم.. ونسبة الفقر وحقوق الإنسان عليك أن تبحث فيها قبل كتابة تغليقك
15,مبادرة طيبة،لكن المؤسف هو أن عدد الحالات المصابة بالفيروس في الصين وصل لأكثر من 25 الف حالة وعدد الوفيات تجاوز 80 حسب وسائل الإعلام، والمشكل هو أن المغرب لم يوقف الخط الجوي المباشر بينه وبين الصين!!!!!!!!!!!!!! وقالوا بانهم يراقبون جيدا كل القادمين من الصين؟؟؟؟؟ ؟؟؟؟؟ رجاء لاتستهتروا بصحة المغاربة الضعفاء..... نحن حاليا في غنى عن السياح الصينيين. اللهم احفظ بلدنا من كل سوء. أمين يارب العالمين.
6,يجب وضعهم تحت المراقبة وعزلهم لمدة اسبوعان وهي المدة التي يظهر فيها الفيروس...التدابير التي اتخذتها فرنسا مع رعاياها القادمين من الصين يجب ان تطبق والا استفحلت الكارثة ..ونظامنا الصحي العاجز لن يكون قادرا على مواجهتها
2,ما هو مصير باقي المغاربة المتواجدين بباقي مقاطعات الصين الأخرى وعددهم بالعشرات وجب ترحيلهم هم كذلك لأن الفيروس إنتشر في كل الأرض الصينية بمختلف مدنها ومقاطعاتها .
6,الى المعلق رقم 27 زوكوكلواذا ذاقت بك الحياة في وطنك و تريد الهجرة فعليك أن تدفع طلبك لأن الطائرة متوجهة الى الصين لجلب الاخوة المغاربة ستتجه فارغة لتعمل على نقلك اليها دون دفع و لو سنتيما واحدا و ابقى في الصين احسن لك من اوروبا لان اوروبا تطرد كل مغربي لا يتوفر على الاوراق القانونية. الانسان يحمد الله على صحته اولا و يبحث عن العمل. و كل من له الذراع يجد العمل بكل سهولة .
1,الشكر موصول لوليد سامي اللدي اثار الإنتباه لهده الواقعة و شكرا لصاحب الجلالة على هده الالتفاتة الكريمة . و لو ان الترحيل معقد بسبب الحجر الصحي على المدينة ... و لكن يجب أن نتفائل .
-1,يجد أكثر من 700 الف مغربي في الصين؟؟؟؟لم يحل أحد- أين الطائرة التي نقلتهم- كلام فارغ
0,إنها إلتفاتة مولوية كريمة التي منحها جلالة الملك لهؤلاء الطلبة المحاصرين في الصين بسبب فيروس كورونا الفتاك، و لولاه لما تم إنقاذهم من الورطة التي وقعوا فيها، فهل يا ترى ستشمل هذه الإلتفاتة المولوية الكريمة إلى وضعيتي التي قد أشرت إليها في تعقيبي أمس في هذا الموضوع، أتمنى ذلك بعدما فقدت الأمل من حكومتنا الموقرة؟. عاش الملك وجعله الله ذخرة لهذا الوطن و عاش الشعب المغربي مكرما معززا في رعاية أمير المؤمنين نصره الله.
3,شكرا جزيلا لجلالة الملك .... زعما الحكومة ولا المسؤولين ميقدروش يخدموا واتاخدو القرارلت وزيد عليهم حتى السفراء لي كيمثلو الملك والدولة المغربية كلشي ناعس وشي كيسميها فشي هادشي لي كيعصبنا كيخدمو غير ولادهم ومصالحهم وزايدينها بتخراج العنين فالتلفزة والبرلمان... يجب المتابعة الطبية الجيدة لهؤلاء الطلبة
0,الله يحفظ المسلمين من هذا الوباء القاتل يارب
