vote,comment
35,المغاربة لا يخافون من الموت، والدليل هجرتهم بحرا هروبا من الحگرة ...
61,اودي طلبوا غير السلامة اما كورونا غاتشد وزارة الصحة ديالنا مع معندها صحة ستفترسها افتراسا لذا نسأل الله ان يبعد عنا هذا الوباء...فالصين بتطورها في المجال الصحي ودهشات...تحياتي
13,بشكل مفاجئ أعلن المطعم الصيني المتواجد بمدينة فاس،صباح اليوم الجمعة 31 يناير الجاري إغلاق أبوابه أمام الزبائن ابتداء من 31/01/2020، إلى أجل غير مسمى.فان المطعم المذكور اعلن لزبناءه الذين كانوا يتوافدون عليه بأعداد مهمة إغلاقه ابوابه ابتداء من اليوم الجمعة إلى موعد غير محدد ، مشيرة ان الإعلان الصغير الذي ثبته بمواقع مختلفة من واجهته الأمامية آثار فضول المارة الذين عمدوا على توثيق الإغلاق بصور وفيديوهات، خاصة أن الإغلاق الذي لم تحدد مدته ولا سببه
17,الوباء وصل حتى إلى اوربا ، فرنسا اكتشفت 4 حاﻻت ، وهناك تخوف كبير رغم الاحتياطات المتحدة ، حفظ الله بلدنا الحبيب من كل سوء.
126,إن شاء الله تصير الصين في مصاف الدول المتخلفة الجائعة كجيرانها نيبال، كل هذه المصائب سلطها الله على الصين بسبب اضطهادهم للمسلمين الأويغور. كلها من دعوات المضطهدين المستضعفين. اللهم أهلكهم
46,"شركة apple وخا تنوض الحرب ماغاديش تحيد الناس من المعامل ديالها اللي ف الصين, هادي عام ونص تفضحات انها كتخدم اطفال صينيين ف مصانعها وكتبيع منتجاتها ب مئات الدولارات والاف الدولارات وكتخلصهم ب جوج ريال للساعه ودبا ف قلب الازمة البيولوجية ماقادرينش يخليو حتى الخدامة يمشيو لديورهم يجلسوا فيها.. من احقر الشركات في العالم."
 43,الوقاية من فيروس كورونا تستوجب الابتعاد بمسافة لا تقل عن عشرة امتار عن كل من يحمل ملامح آسيوية. والابتعاد عن كل من اتى حديثا من منطقة آسيوية. سكان شرق آسيا من اكثر شعوب العالم عفنا وقذارة، فهم يأكلون كل ما يدب على الارض، وكل ما يطير في السماء، لا بسبب المجاعة، بل ببساطة لأنهم قوم معفنين، يأكلون الدود والصراصير والخنافس والفئران والطوبات والخفاش والخنزير البري والافاعي والسحالي والحمير والقطط والكلاب والقرود، والسمك النيء.. يستطيعون اكل اي شيء يتحرك، بدون طهي، بل ان بعضهم يفطر في الصباح على قهوة مصنوعة ببراز القرد، ويسمونها قهوة فاخرة، ويبعونها لضعاف العقول والمخبولين من السياح بعد خلطها بالتوابل لاخفاء رائحة البراز، لهذا تنتشر بينهم الأوبئة والامراض الفتاكة، فبعد وباء سارس القاتل الذي انتشر في 2002 وقتل المئات، ها هو يعود هذا الوباء بحلة جديدة اكثر فتكا، وهؤلاء الأسياويين يعرفون جيدا مدى عفن وقذارة ابناء شعبهم، لذلك تجد العديد منهم يضع كمامات في الاماكن المزدحمة.
-9,الله يهديكم. اش من انهيار. الصين دولة قوية وستتجاوز هذه المحنة. الصين مرت من محن اصعب من هذا وتجاوزتها. المواطن الصيني مواطن يعمل بجد ويحب بلده.
42,لم أرى أنذل من بعض التعليقات التي توزع اقدار الله على هواها فأذا اصاب من يكرهون مكروه قالوا عقاب و اذا اصابهم المكروه هم انفسهم قالوا ابتلاء! الفيروس فيروس لا يصيب على الهوية والعقيدة ايها الاذكياء و اذا انتشر في الصين فيسيقتل ايضا المسلمين الذين تتباكون عنهم لانهم ببساطة جزء من المجتمع هناك و لتسألوا انفسكم اذا كان عقابا فما ذنب الأبرياء و ماذنب الدول الاخرى التي انتقل اليها ؟ نسأل الله الشفاء لجميع خلقه و ان تتجاوز الصين هذه المحنة و تخرج منها سالمة و ان يبعد عنهم وعنا وعن جميع البلاد كل مكروه و ان يحفظ العلماء المنكبين في المحتبرات لانقاذ البشرية.
33,واش ما بغيتوش تفهمو ان الفيروس كيهدد الدول الفقيرة و منها الدول العربية اكثر من الدول القوية و منها الصين.راه فيروس ماشي زلزال و عاجلا ام اجلا غادي يضرب الدول الإسلامية الفقيرة مثل بنغلاديش و باكستان و نيجيريا و مصر و المغرب و ديك الساعة بغيت نشوف اصحاب العقاب الالهي.راه ممكن يتلغى الحج هذا العام بسبب كورونا يا اصحاب العقاب الالهي.راه كورونا فالصين ما غادي يعرف لا مسلم ولا بوذي و يقدر يقتل حتى مسلمي الصين اكثر من اللي قتلت فيهم الحكومة الصينية.و من فوق هاذشي اش دخل الشعب الصيني بشي حاجة دارتها حكومته الشيوعية .و خدمو عقولكم راه طريقة تفكيركم اخطر من كورونا
19,نقطة نظام .كل العلماء في الدول المتقدمة سواء في اروبا او امريكا او في الصين واليابان وروسيا يبحثون اليوم عن لقاح جديد لكرونا ، ومثلما وجدوا في السابق علاجات ولقاحات ضد الكثير من الفيروسات الموسمية ، اكيد سيجدون لقاح جديد لكورونا..لهذا اقول لبعض التعاليق الغبية جدا الذين يتشفين في الصين، لاتنسوا ان هناك أقلية صينية مسلمة تعيش هي الاخرى في الصين واذا ما اصاب الصينين مكروه سيصابون هم كذلك.منذ عقود طويلة ان لم اقل منذ قرون والمسلمين يدعون بالويل والتبور داخل المساجد للفرنسيين والبريطانيين والامريكيين والاسراءيليين، لكن الله لا يستجيب لدعاءهم على الاطلاق ، بل بالعكس من ذلك نلاحظ ان هده الامم تتقدم يوم بعد يوم وشهرا بعد شهر وسنة بعد اخرى اقتصاديا وعلميا وعسكريا، بل وعلى جميع الاصعدة كما في علم الجميع.
24,سبحان الله..فيروس صغير جدا ينبغي تكبيره آلاف المرات بالمجهر لرؤيته ومع ذلك فهو قوي جدا..ولهذا أعشق كلام رب العزة في كتابه الحبيب فهو دائما يخبرنا بكل شيء ولكن أكثر الناس يغفلون عنه..وهنا أتذكر قوله تعالى : وما يعلم جنود ربك إلا هو..جندي بالغ الصغر لكنه بالغ القوة..إنها قوة القوي العزيز..
18,"اقتصاد الصين لا يرتبط بالتساقطات و صلاة الاستسقاء و رهن الأخضر و اليابس في قروض ""زعطوط"" . الصين لا يسيرها ""لحلايقية"" لينهار اقتصادها بسبب فيروس هي تبحث له عن مضاد و ""النصابة"" يطمئنون و هم قابعون ينتظرون ما تأتي به الأقدار . إنها الصين يا سادة التي لا يخلو بيت من بيوت العالم من منتوج من منتوجاتها ."
2,ما اله دخل بالفايروس او بالناس البريئة الله يعينهم بحزن عليهم ، لكن انهيار الاقتصاد الصيني بشكل كبير، كانوا المسلمين المضطهدين و الصينين الرافضين لاضطهاد المسلمين يوعوا العالم بمقاطعة المنتجات الصينية لكن مو الكل كان عم يقاطع ، وما كان التأثر بالاقتصاد واضح بينما هلئ السبب رباني بانهيار الاقتصاد الصيني ، هاد اللي بقصدوه اصحاب التعليقات
14,الكل يقول أنه فيروس انتقامي لما يفعله الصينيون بإخواننا المسلمين ولم يفكر أحد بأن يكون فيروس سياسي واقتصادي، وان تكون محاولة جديدة من امريكا من اجل تدمير اقتصاد الصين المتصاعد بعد عدة محاولات لم تنجح 100%، هل يمكن أن تنجح هذه محاولة؟ سؤال ستجيب عنه الأشهر القادمة.
-9,العلماء الحقيقيين الان منكبين فى المختبرات لايجاد مصل لهذا الفيروس فى حين من يسمونهم (علماء الدين ) الذين لا يفقهون فى شىء سوي العنعنات . السؤال بم أفاد البشرية هؤلاء من يسمونهم علماء الدين ؟
-7,الانسان الصيني انسان مجتهد ومثابر ولا خوف على اقتصادهم .الصينيون ياكلون كل شىىء لان عددهم كثير جدا ولانهم احرار لا يحكمهم الموتى ولا ننسى أن اجدادنا كانوا ياكلون الجراد والذياب والثعالب وينتظرون المساعدات من الدول اخرى كالحبوب والحليب .
16,ان الله يمهل ولا يهمل،الصين تجني ثمار افعالها وثقافتها ونمطها الغذائي الذي لا يختلف عن النظام الغذائي للحيوانات،شعب مقرف،مقزز،رغم تطورها العلمي الا انها متخلفة ولا تحترم معايير الصحة،الى مزبلة التاريخ.
11,إني أدعو السلطات المغربي إن كان بهم وطنية و خوف على الشعب المغربي البسيط أن يطردوا هؤلاء الصينيين لأنهم حاملي الفيروس الخطير. ماذا تنتظرون أقطعوا العلاقة مع هؤلاء البشر حتى يذهب هذا الخطر.
8,"يقول الله تعالى ""وما يعلم جنود ربك إلاّ هو"""
-2,عدد الموتى بسبب السرطان وامراض القلب والشراييين،وضحايا حوادث السير،في العالم،هذا الاسبوع يقدر ب 26000 شخص،ما رأيكم ايهما اخطر على الحيات البشرية،افتحوا عقولكم انه التهويل.
2,أرى أن الفيروس تحت السيطرة ومن الطبيعي أن يزداد عدد الوفيات لأن الضحايا من المصابين سابقا .أما ما تبقى من الأيام وبعد عشر أيام على أكثر تقدير سيبدأ العدد في تنازل .
31,ما فائدة انتاج كل هاته الماسكات ؟ على الصينيون تغيير سلوكهم فالعالم كله اصبح لا يطيقهم ياكلون حيوانات غريبة بسببهم تنتشر الفيروسات ويلوثون الكرة الأرضية بسبب الانتاج والاستهلاك المفرط عليهم خفض عددهم الى 300 مليون نسمة حفاظا على سلامة البشرية و سلامة الكرة الأرضية والمناخ والبيئة
0,ردا على أخ باعمراني .الحمد لله على الصين كون ما ماكنتش الصين كون كاع ما زالت تلفزة كتبدا حتى 6 لعشية و تسالي في 10 الليل.
1,الصين شعب الانتاج، الصين يبني مستشفى في وقت قياسي لعلاج المصابين بفيروس كورونا. الصين تنافس وتزاحم الولايات المتحدة الامريكية اقتصاديا. الصين رائدة في كل شيء، حتى في الأمراض.
4,الصين ستخرب العالم عما قريب، هناك تقارير عن تخريب الصين لدول افريقيا السوداء بيئيا واقتصاديا، والان جاء دور الأمراض
7,حفض الله المغرب ملكا وشعبا تجرعو ما فعلتم مع المسلمين طبعا نعرف انهم مسلمون افضل من العرب لدالك ستجاب الله سريعا لهم
39,نسأل الله اللطف والسلامة...لهذه الطوارئ الخطيرة الناجمة عن توقع إنتشار الفيروسات والاوبئة تستعد الدول الراقية وتبني وتجهز المستشفيات وتشجع البحت العلمي....!!! أما نحن ضعاف نسأل الله ان يجنبنا المصائب وان يحفظ كل الامة الإسلامية.
21,لا يعلم جنوده إلا هو. صدق الله العظيم
17,"قال رسول الله صلى الله عليه وسلم ""إنّ في الحبّة السوداء شفاء مِنْ كل داء إلا السام"" رواه البخاري ومسلم. لهذا فأنا أدعو جميع الباحثين وعلماء الطب لأخذ الحديث الشريف بمحمل الجد وتخصيص جناح بمختبراتهم للحبة السوداء ودراستها وتحديد منافعها واستخلاص العلاج منها لما عجزو عنه حتى الآن كفيروس كورونا"
10,هاذ المرض الله ينجينا منو من عينيك يمكن يذخل وكذلك يخرج أو هاذ الفيروس كيطير...القضية مافيهاش اللعب
20,اللهم اشفنا انت الشافي لا شفاء إلا شفاؤك شفاء لا يغادر سقما
11,ولماذا لم تلغي الخطوط الملكية المغربية رحلاتها الصين ؟ هل نحن احسن من المانيا ؟او نحن طماعون اكثر من المانيا وبريطانيا واندونيسا ؟ام نحن حمقى لا ندرك مكامن الخطر ولا نهتم لصحة الإنسان المغربي؟....أسئلة تحتاج اجوبة من ولاة الأمر ،عليهم ان يقفوا الان امام انفسهم وامام الله وامام الأمانة التي حملوها.....بان مصير شعب لاحول ولا قوة له في أيديهم...وهم العارفون بان الميزانية والنظام الصحي بالبلد لا يحتمل حتى مرض بسيط فكيف بوباء ..انهك الصين بقوتها....كنا كفقراء وبسطاء ومداويخ الشعب ننتظر راي المجلس الديني الاعلى ان يفتي بما هو موافق للشرع،.لكن يظهر انه يراقب الهلال فقط ...وليس متابعا لما يقع في هذه الارض..فقهاؤه غارقون في ادبياتهم العتيقة..وكنا نأمل من النقابات الصحية ان تعي حجم الثقل الذي تتحمله ..وتفعل كما فعلت نقابات الصحة بهونغ كونغ للضغط على الحكومة لاتحاد اقصى درجات الحيطة..ومنها الغاء رحلات الطيران وتبين ايضا ان النقابات الصحية تخرج عندما يتعلق الامر بالمال فقط .....كنا ننتظر أن يعرف ولاة الأمر اننا بشر ايضا نخاف ونفزع ونحب ونريد ان نعيش بكرامة فقط
0,الغرب اكثر وقاحة مما يظن اغلب الناس ستجد هدا الفيروس من انتاج احد مختبرات الغرب بإيعاز من مخابرات امريكا او ربيبتها اسرائيل باش يدخلون الصين سوق راسها و يساوموها باللقاح مقابل تنازلات اقتصادية ونتذكر ما كانو قد فعلوه مع اليابان للحد من فورتها الاقتصادية انهم يجيدون اللعب الوسخ و اللكم تحت الحزام هده سياستهم او ما يعرف بسياسة العصى و الجزرة قبح الله اليهود.
11,الادوية هي براميل الفوسفور ، صواريخ كراد، وطائرات الدرون المقنبلة وقد جربت هده المضادات في اطفال ونساء وشيوخ سوريا الشهداء.
-37,واصلوا عملكم يا كفرة ،أما نحن سنكتفي بالدعاء والحبة السوداء وحين يأتي الفرج سنجد أن العلاج قد اكتشفناه قبل ١٤٠٠ سنة...
14,الاشكال هو لو انتقل الفيروس إلى دول فقيرة ولا تملك أنظمة صحية عالية ولا اطر دات كفاءة عالية،ولديها موارد مادية قليلة ميزانيات صغيرة لا تكفي لسد حاجيات يومية ،هنا يجب على هذه الدول اتخاد تدابير صارمة جدا اكثر من الدول المتقدمة وعلى المغرب وقف الخط المباشر مع الصين شركات كبرى وقفت رحلاتها اخرها العال الإسرائلية و..خطوط اخرى..الأسئلة الكبرى هي هل ميزانية المغرب تسمح بمواجهة وباء ؟هل نعتمد على مساعدات اجنبية ام ماذا؟ هل نلجا للقروض ؟. الأطر والبنيات التحتية هل مهيأءة فعلا اهكذا سيناريو لا قدر الله ..هذا ما يجب ان يثحدت عنه البرلمان والحكومة وكل مسؤول ..نحتاج لتصور شامل..ميزانية الصحة بالمغرب ضعيفة جدا وغياب مختبرات البحث العلمي وبالكاد تواجه امراض كالسكري والزكام.نحتاج لتفكير جماعي هذه الايام....تفكير عميق ومنطقي وليس تفكير الحبة السوداء
10,هنا يكمن الفرق، بين أطباء أجلاء يسعون لإنقاذ البشرية من خطر داهم، و بين أطباء نصابين يمتصون دماء المرضى بشتى الوسائل ( عمليات جراحية غير لازمة، مكوث زائد بالمستشفى، أثمنة جد مرتفعة مقابل خدمات متواضعة، الأداء في النوار) و ينتظمون في ما بينهم عبر شبكات منظمة.
7,لطفك يارب استر امتنا المسلمة وباقي العالم من هدا المرض الخبيث
79,البشرية تتجه نحو الهاوية ليس بسبب الكورونا و انما بسبب اخلاقها من أجل الشهرة و كثرة المتتبعين أصبح البعض يقذف في أعراض الأخرين أو يستعمل ايحاءات ذات مغزى عنصريو للأسف الأخبار الكاذبة عن الكورونا أكثر من الأخبار الصحيحة و المفيدة اللهم بعض المواقع المسؤولةنحن فيروس أخطر من كورونا
-75,صرح بعض السياسيين ان الصين قوة رجعية تنوي تحويل جنوب شرق آسيا إلى منطقة لنفوذها ألا ينطبق هذا على المغرب القرن أوسطي .
84,على السلطات المغربية وقف الرحلات الجوية الى الصين....ماذا ننتظر ...بعد ان توقفت خطوط عالمية كبرى؟
103,فعلا الصين او الصينيون يشكلون خطرا على العالم متلهم متل هاد الفيروس بحيت أينما حليت وارتحلت تجدهم متل كوكاكولا وفي جميع القارة بحيت بستعمرون العالم بتجارتهم الرخيصة و مطاعمهم كذالك الرخيصة وليس بالسلاح ويقيمون مدنهم الخاصة بهم ولا ينسهرون في المجتمعات الأخرى ويتملصون من الضرائب وفي غالب الأحيان يقيمون في بلدان أخرى كاوربا وكذالك المغرب وبلادنا جنت على نفسها برفع التأشيرة عليهم، قوم هاجوج وماجوج
-26,ومع ذلك لم نسمع أنهم اتهموا الغرب بالتآمر عليهم، لو كانوا مثل ذلك القوم المعروف، لغمروا وسائل التواصل الاجتماعي بمظاهر المظلومية وكل أنواع نظريات المؤامرة وأن كل ذلك لمحاربة دينهم الخ الخ
55,اما نخن في المغرب فلا مجال للمقارنة بالدول التي تعتز بمواطنيها.. اصلا هنا المواطنون يموتون كل يوم بقلة الاسعافات و الادوية و التطبيب و لا نحتاج الى كورونا فالمغرب له كورونات مختلفة في كل المجالات و خير مثال مستعجلات مستشفى الادريسي الذي يعج بمواطنين ينتظرون سوى القبر.. الله غالب
11,كما قيل و يقال ، للنجاح ثمن .كالمعتاد ، الدي لا يستطيع المنافسة الشريفة و لا يقبل تفوق غيره عليه ؟يطعن من الخلف!! و هدا أسلوب حقير يسلكه الجبناء .الصين بلد عظيم .الصين مهد الحضارات .الصين قوة عظمى بسواعد أهلها لم تكن يوما بلدا إمبيرياليا .إدا كان الصينيون يأكلون الحشرات فداك شأنهم في كل البلدان عادات يعتبرها الغير غريبة إدا حصل و انتشر فيروس ما بسبب عادة ما فدلك وارد في كل بلاد العالم .و تحية راقية للشعب الصيني العظيم .
12,انا لم اسمع يوما بفيروس انتشر بامريكا فهل هي تطلق غازات في الهواء تطرد الفيروساتاما عن الصين فليست معاداة بل فقط احتياطات من طرف الدول
10,من الطبيعي ان تنمو مشاعر كهذه لدى بعض الشعوب ومنها العربية، لانها تربت على حب النفس، في حين أن الارض ملك للجميع وللجميع الحق في العيش كما للجميع عاداته وتقاليده التي وجب احترامها.ولنا فيما يحدث من تقتيل في دول الربيع العربي اكبر دليل على ان الحقد مدفون داخلنا ينتظر الفرصة المناسبة للخروج للعلن ليعبر عن تناقض تعايشنا الزائف.وما كورونا الا شيء بسيط مما ينتظر العالم في المستقبل.
20,لماذا الدولة الصينية لا تهتم بصحة مواطنيها بسبب غياب المراقبة قد تتسبب في وباء فتاك يدمر جميع البشر .......ما فائدة الدولة إذا كانت عاجزة عن منع اكل الخفافيش اذا فنحن امام دولة ضعيفة همها فقط جمع الدولارات...
12,مند قرون و اغلبية الصينيين ياكلون اشياء غريبة فلمادا الفيروس في هدا التوقيت بالداتاتمنى ان تتعاون الدول لوضع حد لانتشاره اما ادا كان السبب هو التغدية فمن الاحسن ان تجلب الصين بعض حاجياتها من الخارج و لو لمدة معينة
45,الفيروس أو الوباء انتقل من الحيوان والطيور الى الإنسان وأخيرا بدا هذا الوباء ينتقل من إنسان الى إنسان ، الدول العظمى بدأت تحس بانها هي الأقوى وهي التي تحيي وتميت وأخطأت الطريق وأصبحت نظرتها الى الكون والإنسان والحياة مادية فقط ولا تؤمن بالغيبياة بان لهذا الكون مالك وخالق . الصين أجرمت في حق المسلمين تبيد وتهجر وتفصل المسلمين حتى تقضي على ديانتهم وتمحورها من الوجود بمباركة صمت عالمي لانهم لم يراجعوا تاريخ من قبلهم كيف اهلكوا بعد إعلانهم الحرب على خالق الكون والإنسان والحياة
33,هههههمنذ عقود والعالم كله ينظر الى المسلمين بنظرات عنصرية ولا احد يحرك ساكنا مساكين الصينيون يعيشون حالة من العنصرية كل القنوات الفرنسية بثت برامج ومقتطفات من الشارع حول هذه العنصرية بالأمس والكل ينكر هذا العمل المشين الله الله اللهكم استرحنا ليوم واحد ما احلاه ههههه
