vote,comment
7,مع الأسفمع الأسفمع الأسف......مع كاااااااامل الأسف، هناك بعض أشباه مغاربة الأنانية عششت في نفوسهم !!! صافي، كلشي كيتهرب منهم، فكر في أم أو أب أو زوجة أو إبن ذلك المغربي لي وجد نفسه بعييييييداً بأميال عن وطنه و هو مهدد بالوباء، باقي كاع ماعرفتوهم واش مصابين أو لا و خرجتوا للعيب ؟؟؟ماشي هذا هي أخلاق المغربي المسلمأو المغربي المسيحيأو المغربي اليهودي.........لا أظن !؟
10,رد على سيمو صاحب التعليق 5 يقال أن الجهل عدو الإنسانألا تعلم يا هذا أن الدستور المغربي يقول في أول بنوده أن الملك هو رئيس الدولة ؟ ألا تشاهد أخبار الدول الأخرى أيضا الرئيس يقوم فيها بكل شيء مثلا امريكا تسمع ترامب فعل ترامب أمر ترامب..ترامب.... و في تركيا نسمع أردوغان....و هكذا....المشكلة هي أن امثالك رأس مالهم غير لكريتيك و الهضري. إلى الملك ما كيبان كتقولو فيناهوا كاع ما مسوق لينا. و إلى بأن تخرجو تنبحو عاوتاني علاش الملك دار علاش قال...الناس خدامين و مقابلين شغالات. و لي مسالي قبو شاد تيليفون و سارق الانترنت من عند القهوة لي حداهم و مقابل لكريتيك و الشفوي . و يصحب عند راسو هو تشيغيفارا العصر عاش الملك ولا عاش من خانه
5,والشينوة اللي كيدورو فشفشاون وأكادير ومراكش عاد وصلو ...دايرين ليهم الحجر فلوطيلات ولا؟ ....اللي فهم شي حاجة ينورني
2,"La France, parmi les destinations favorites des chinois, ne s’inquiète pas alors qu’elle a été incapable de détecter un cas qui s’était présenté de lui-même. Confirmation du 5eme cas en France.فرنسا ، من بين الوجهات المفضلة للصينيين ، ليست قلقة عندما لم تتمكن من اكتشاف حالة قدمت نفسها. المفاجئة الاقتصادية للسياح الصينيين >>> صحة الفرنسيين"
-3,مكناس متيبان ليكوم غير فالمصائب الكحلة مكتعرفوهش فالاستثمارات مكتعرفوهش فالمشاريع ......الله يستر تولي مكناس بؤرة هذا الداء ...الله يحفظ الطلبة اللي رجعو مساكن من الشينوا
2,بريطانيا كذلك ستجلي البريطانيين العالقين في ووهان غدا الخميس و سيوضعون في معزل لأسبوعين تحت الرقابة الصحية و ربما قربا من معسكرات القوات المسلحة البريطانية.
-3,السؤال هو اين المجلس العلمي الأعلى شرعيا لا يجوز ارجاعهم ،اتمنى او سمعنا راي المجلس العلمي الديني وليكن صريحا،كان على السفارة في الصين دعمهم بكل ما يحتاجون بالتنسيق مع السلطات الصينية دعما كاملا حتى تنتهي إجراءت الحجز على المدينة الصينية، قطاع الصحة عندنا مجرد قطاع مترنح وهش وضعيف على مستوى االاطر دات الكفاءة المهنية المتواضعة وعلى مستوى الأدوية والبنيات التحتية ويعرف المخزن هذا جيدا ،السؤال الاخر لماذا لا تخرج نقابات الصحة للتظاهر لاتحاد اجراءات صارمة على مستوى الحدود ومنع الطيران ووو كما فعلت نقابات هونغ كونغ ولكن نقابتنا تخرج للمطالبة بمزيد من المال فقط .الامور الاخرى لا تهمها ولا مسؤوليتها يعرفونها....النقابات الصحية بهونغ كونغ هددت لاضراب شامل ان لم تغلق حكومة هونغ كونغ الحدود وتمتع الرحلات القادمة من الصين...لان ذالك هو الطريق الوحيد للظغط على الحكومة وهو مبدأ الوقاية خير من العلاج...
-2,مبان ليهم غير مكناس التي تقع وسط المغرب.الله يستر في حالة تسرب الفيروس خفية من مستشفى سيدي سعيد فانه سينتشر في كل الاتجاهات شمالا جنوبا شرقا و غربا.لدى كان الاجدر ترحيلهم لمنطقة نائية بعيدة عن المدن الكبيرة سواءا في الجنوب الشرقي او الجنوب .طاطا او الزاك او اعالي الاطلس .
6,الى المكناسي صاحب التعليق 37لقد تم اختيار الرباط مكناس لتوفرهما على مستشفيات عسكرية مجهزةاما الاستثمار فيقوم به الخواص دوي الاموالوكان عليك ان تلوم اخوانك المكناسيين اللدين لا يستثمرون في مدينتهم ويفضلون الاستثمار في مدن أخرىوايضا المنتخبون اللدين لا يبدلون اي جهد للنهوض بمدينتهم رغم توفرهم على ميزانياتالمواطن الواعي هو من يفكر تم يستوعب قبل كتابة التعليق
-3,الحمد لله اللي المغرب دولة ملكية عندها ملك واقف على الشادة والفادة أما الى عولنا على حكومتنا كون راه كورونا فيروس بدأ انتشاره في المغرب قبل الصين
 0,حتى الطاقم الطبي يجب عليه ان لا يغادر المعزل حتى تنتهي المهمة . على المكلفين بتأمين المكان ان لا يتركوا حتى ذبابة تغادر المعزل. و اتمنى من الله عز و جل ان لا يكون احدا منهم مصاب.
19,دعوات الإيغور وتضرعاتهم فتحت لها أبواب السماء،ياصين الظلم والإضطهاد فوق الكفرلن تستطيعي الحرب مع الله،فاهتدي فهذه رسالة غضب من الله.
2,السلام عليكم ولله في خلقه شؤون. إخواني أخواتي. أنظروا كيف فعل الله سبحانه وتعالى بقوم الظالمين .وهم لا يبالون. فهاكذا عاش المؤمنين.والمسلمين .مع أنبياء الله ورسله .فكما قال الله سبحانه وتعالى في كتابه الكريم .(سورة البقرة).ولا يزال يقاتلونكم حتى يردونكم عن دينكم .إن استطاعوا.الله وحده أعلم كيف كانت الصين تتعامل مع مسلميهافاخرج الله لهم فتنة ومرض فتاك يعجز علمهم تصدي له. فاين نحن من الغفل عن ديننا والتقصير فيه واتباع الشهوات .والنميمة.وووووالخ.اللهم اعز الاسلام والمسلمين واذل الشرك والمشركين وأخدل أعداء الدين ووحد صفوفنا واهدنا على بعضنا وصفي قلوبنا .لأنه بهاذا نواجه الفتن .وما اكثرها حدثنا عنها رسول الله صلى آلله عليه وسلم. تحية الى جريدة هيبريس واحفظ مولانا وسيدنا محمد السادس نصره الله
2,حوادث السير تسجل 11قتيل سيذهب هذا الكورونا وتبقى حوادث السير...
-28,انها نهاية العالم ، و السبب الخروج عن قانون الطبيعة .
-30,المشكل ان اكثر السياح عندنا من فرنسا الله احفظ وصافي واش انحبسوا السياحة ولا اش هو الحل ولكن نحن المغاربة شعب مضياف خاصة مع الفرنسيين ولو ان سياحهم مصابون بفيروس كورونا مرحبا بهم وبفروس كورونا نحن بلد الترحيب والاستقبال
18,فرنسا تسعى لتخويف افريقيا وفرض شراء اللقاحات
9,صافي كملات هد البلاد خصها غير شي مرض كثر من هد المرض لي حنا فيه هيا غير نوجدو شريحا و الثومة المخنزا
11,وكشف مدير وزارة الصحة جيروم سالومون أن المريض الذي يُعتقد أنه يبلغ من العمر 80 عاما يعالج الآن في باريس وحالته خطيرةالخوف من الله أصلا هذا الفيروس مرسل من عند ربنا الى الصين الذين تعدو الحدود على إخواننا الإغور والله يمهل ولا يهمل وأوجه الرسالة إلى فرنسا أن تبيع الحقون والأدوية لشعبها وليس لنا نحن المغاربة
13,دبا الكمامه ديروها ولالا الفرنسيس راها بحال النقاب
14,ابتزاز الصين بالفيروز لتركيعها من طرف حسادها امر صار عادة غير لائقة وخطيرة فبعد حرب السارس عليها حرب كورونا من جديد وقد تنفجر حرب عالمية لا تبقي احدا.
30,هاته المرة لن تسلم الدنمارك من غضب الصين ،كوبنهاكن لم تأخذ العبرة من رسوم الرسول (ص) لانها كل مرة تقحم ذالك في خانة حرية التعبير....والآن تريد الصين استرجاع بعض الحيونات النادرة كانت قد اعترتها لحدائق دنماركية
86,و لما كان الصينيون يعذبون وويحتقرون المسلمين الايغور لم يأخذو بعين الاعتبار مسلمي العالم. و الكاريكاتور اعتبروه اهانة. كيف يعقل هدا.....
68,الإعتذار أنتم قتلتم و شردتم الملايين من المسلمين و ما أصابكم هو إنتقام الله منكم
15,الصحيفة الدنماركية معروفة باتارة المجتمع الدولي بمثل هذه الرسوم الكاريكاتورية الاستفزازية للانتشار في العالم وتحصيل مداخيل مرتفعة....وهذا الرسم ينم على المكر والخديعة المستشري في دواليب الصحيفة الدنماركية كما هو مبين على العلم الصيني.،،،ونسئل الله الصحة والعافية للجميع،،،.
28,"انا مقيم في اسبانيا واستغل مع الصينيين مند زمان. ممكن هدا الرسام اساء للمسلمين وهو يعرف اننا نطبل ونزمر فقذ ونخرج اسبوع او اسبوعين الى الشوارع وانتهت العنترية. الصنيين. يحبون بلادهم اكتر من ابناءهم. فلا يندفعون ولا يخرحون الى الشوارع. هم يخططون بالمال بالتضامن حتي يرغمون من اساء لهم بالتراجع والاعتدار. ساحكي لكم قصة وقعت للصينيين هنا مع بنك caixa, حيت فزض على جميع الصينيين الادلاء بشواهد العمل ومن اين تاتي الاموال وحدد لهم عدد قليل من المال ممكن ان يرسلوه الى دولتهم. اعتبروه اهانة لهم. البعض منهم فكروا في الخروج الى الشوارع. البعض تريض وستفسروا مع كل الصينيين الموجودين علي تراب اسبانيا. النتيحة الخروج الى الشارع لا يغير الشيئ. فسحبوا جميع اموالهم من البنوك. في ضرف 24 ساعة اعتدر البنك. والتزمو جميع البنوك الا يتكرر متل ما حصل. اكيد هده الجريدة او الرسام ستكون النهاية على يد الصين بدون شك."
20,ليس من الأدب أو الإنسانية في كل الدول التشفي في المريض٠ما قامت به هذه الصحيفة يعكس تدني أخلاق طاقمها وأنا بحكم احتكاكي مع هذا الصنف الذي لا يرقى لصنف البشر،أكاد أجزم أنهم فقدوا إنسانيتهم بحكم إدمان المخدرات والكحول وكل أنواع البلاوي التي لايمكن تخيلها٠ فعلا المهاجرون ومنهم الصينيون هم من بنوا الدانمارك وهم من يشتغلون ليل نهارفي المصانع هناك٠ جولة سريعة في أي مصنع يمكن للإنسان أن يرى أن المهاجرين هم من يشتغلون فعلا٠ أمر مشين أن تجلس على كرسي في مكتب وتبدأ في قدف أسيادك وأنت تعيش من عرقهم، إبحث في ظهرالكمبيوتر الذي تستخدمه لتجد أنه صنع في الصين وابحث عن من قام ببناء عمارتك ستجده مغربي، فعلا لم يتركوا لك ماتقوم به أنت غير القدف والسب٠
25,ما ذا ستفعلون أيها الصينيون الظالمون الذين قتلتم وعذبتم الآلاف من مسلمي الإغور وقلتم لهم ما ذا سيفعل ربكم، رب العالمين سلط عليكم فيروزاً مخلوقاً صغيراً فهزمكم شر هزيمة،؟ أين علمكم! أين صناعتكم ،ذهبت في مهب الريح، أصبح العالم يتطير منكم، هذا رب الإيغور وربكم ورب العالمين وإن كنتم لا تؤمنون به
4,الحكومة الصينية اعتدت على المسلمين هناك وهذا رد الصحيفة عوض المسلمين
6,الصينيون يعرضون البشرية جمعاء للمخاطر باكلهم حيوانات غريبة خفافيش وثعابين وقنادس الخ. قرات مقالا يقول ان العلماء يعتقدون ان اصل فيروس كورونا الجديد من الخفافيش وانتقل للانسان عن طريق اكل الثعابين. الكاريكتور مسيئ ولكن لا يقارن بعنصرية كثير من الصينيين. الكل يتذكر اشهار الثلاجة وشتمه للسود.
72,فيروس كورونا قاتل سوف يأتي عن طريق الخطوط الملكية المغربية تدكرو كلامي جيدا. مريكان و فرنسا و المانيا منعو منعا كليا طيارتهم يمشيو شينوة اولا طيارات اجيو من شينوة باش شعوبعم ما تعداش حيث تي خافو عليهم. اما حنا غير قطيع عند دولة المغربية لبغا ايموت رها روضة مهم هما طيارتهم خاصهم ادخلو لفلوس.
7,الحمد لله من كنشوف المسؤولين في المطار كيف كيتعاملو مع المسافرين، والعاملين في المطار، وتوفير اللباس الواقي و الماسكات، كيبان لي اننا مزال متأخرين سنوات ضوئية على دول بحالنا في المستوى.القفازات والماسكات كيبانو ديول شيئ آخر غي الوقاية من فيروس كورونا.
14,وباء كورونا سوف يجدون له الدواء في القريب العاجل، االكارثة عندنا افتك الاؤباة هما مافيات العقار وناهبي ثروات الشعب ، إذا كانت الحكومة مهتمة فعلاً بصحة المواطنين فلا داعي لهذه الخرجات الإعلامية الكاذبة أمام الدول ،انظرو في عاصمة المملكة فقط ساكنة الصفيح آلاف الأسر تفتك بها الأوباءة والأمراض والبرد أمام مرأى ومسمع المسؤولين ولم يحركوا ساكناً ، لو كان وباء كورونا أصيب به مغاربة فقط لما رأيت أي اهتمام من الحكومة ولكن بما أنه وباء انتشر على مستوى العالم اضطروا لتلميع صورتهم أمام الدول هذا كل ما في الأمر.،،ملاحظة مهمة جدا المسؤولين لا يريدون فهم بان الشعب اصبح يدرك كل الاعيبهم ،و على مدى التاريخ والعصور بداية نهاية أي إمبراطورية أو دولة عندما تتخذ القمع وإذلال شعبها هو السبيل الوحيد .
10,نحن لا نتوفر على كل ما يلزم من الأجهزة لمحاربة الوباء ،يفترض على الدولة أن تقي مواطنيها شره لأنه المرض الفتاك الذي ينتشر بسرعة النار في الهشيم،وتلغي رحلاتها إلى البلدان التي ظهر فيها الوباء ،والوقاية افظل حل في الوقت الراهن فاي تهور في هذا الاتجاه يتحمله المسؤولون الذين لا يناقشون المسألة بالجديدة المطلوبة.اللهم فينا شر الفتن !!!!!
5,مكين ل مراقبة لا والو . ناس دايرين كاميرات كشف الحرارة . و حنا شادين ميزان ديال الحرارة ديال الدراري الصغار.الناس لي جاين من الصين كيجيو من بزاف د الخطوط سوا الامراتية سوا الخطوط الفرنسية او التركية او القطرية . كاع الطيارات خاص اتقلبو الناي لي جايا فيهم.
4, يظهر انه من الوقاية توقيف مءقتا الخط الجوي الجديد مع الصين لان الوضع خطير عالميا . لانه هاد الخط هو ربط مباشر مع هاد الوباء الدي يهدد العالم وتحدى حتا الصين . وهل يمكن اكتشاف حالة شخص مصاب في اولها دون اعراض فهنا الخطر . فاللهم احفض بلدنا من هادا الوباء
14,بصراحة من خلال الفديو شخصيا لست مطمئنا على الطريقة التي استقبل بها الطلبة العائدون من الصين من طرف عائلاتهم وبدون كمامات وقائية .تعامل الأطرالصحية بالمطار لا يبين الإجراءات الإحترازية اللازمة والصارمة والحجر الصحي الذي يجب القيام به على كل عائد من البؤرة الوبائية بمدينة* يوهان* .فقياس حرارة المسافر لاتكفي لمعرفة سلامته من الفيروس من عدمه، خصوصا وان الأعراض لاتظهرعلى حامل الفيروس إلا بعد أسبوعين لتعرضه لعدوى الفيروس.
7,British airways الغت ابتداء من اليوم جميع رحلاتها إلى الصين إلى أجل غير مسمى لااظن أن RAM سوف تلغي رحلاتها إلى الصين اذا تذكرنا أن نفس الشركة لم تفعل ذلك اثناء انتشار وباء EBOLA في افريقيا في 2014 -2015
0,السلام عليكم يجب على وزارة قلة الصحة توفير البصل في المطار بصلة لكل مسافر اههه .والناس مراض بلا كرونا . لا ادوية لا والو اما الى كانت كرونا الله يحفض جميع . ويحفضكم من تجار الادوية .وخا هما عارفين فين احطو المرض . بغاو الصين تنزل راها طلعات وكتزاحمهم فخدمتهم وبغاو ينزلوها وخا غ 10 سنوات المهم واحد شهر ويبان دوا ويربحو منو شوية . .يبقاو هما محكمين فالعالم .ولي علا راسو يهبطوه الغلبة للاقوى .
7,هذا الشي راه أكثر من الخطر،بزاف من الدول وقفات الرحلات ديالها من و الى الصين،كيفاش دخلوا بسهولة للبلاد ،هذا الشي خطر على الاقل هذا الطلبة خاصهم يكونوا معزولين بعدين على الناس على الاقل خمسة عشر يوما ٣
-3,لم لا تطبق تأشيرة الدخول على الشناوه
6,المفزع هو ترك الركاب واخد ارقام هواتفهم ..يعني لو كان المرض في فترة حضانة فستنتقل العدوى بين اهدا كبيرة بين اقارب وجيران ووو ...وستشخصه وزارة الصحة بواسطة اتصال .ماهده السخافات ...الصحة العالمية تقول ان المرض معدي في فترة الحضانة دون ظهور أية أعراض حتى الحرأرة وكل مصاب يعدي 2 الى 3 اشخاص في المتوسط....هذا استهتار بارواح الناس وسلامة المواطنين نعرف جيدا اننا مجرد قطيع ورعية وتنتشر الأوبئة او لا فلا يهم لان ولاة الأمر اخر ما يفكرون به هو نحن ،اجراءات سخيفة لا تقنع احدا قراءة هذا المقال تزيد الرعب اكثر....لو يهتم ولي الامر ..القطيع لمنع السفر نهائيا وقطع الرحلات الصين....نعرف جيدا ..كيف يتعامل موظفوا الصحة بتراخ ولا مسؤولية ومن باب انجاز العمل لا غير وبطرق غير احترافية.....للاسف قدرنا ان نولد هنا....
4,لكل داء دواء و الله هو الشافي نحن المسلمون لا نخاف من الموت . الموت مكتوب من عند الله فلا تخافوا يا ايها المعلقون المغرب له الدواء كل الأوبئة تاتي من الخارج من فرنسا حمى الخنازير من انجلترا حمى الابقار من الصين كورونا من امريكا حمى ...... المغرب الحمد لله ليس عندنا أمراض لنا الله هو الشافي ان بتلاوة القرآن تشفى القلوب و يذهب المرض . رغم النقص في مستوى المستشفيات الحمد الله ليس عندنا أوبئة عليكم بالفول و الشريحة و الثومة و المعدنوس و العسل الحر و زيت زيتون و لحم المعزي و خاصة الرأس و رجلي الابقار مع الحمص كل هذه موانع للبرودة اظافة الى الحميس بالحلبة و الدجاج البلدي . من اصابه برد في الصدر ما عليه الا بهذه الماكولات . بالإضافة إلى العرݣة و هي ادخال الرأس تحت غطاء و تكون مرميطة مليأة بالكاليتوس مغلية يفتح المرميطة داخل الغطاء و نتمنى الشفاء لكل مسلم تحياتي .
4,ههههه الا حتى يدخل وعاد تابعوه صحيا يعني مادرتوا والو ونعلم انه ينتشر بسهولة ونعلم كيف تعمل الاطقم الطبية ومتابعتها للحالة يعني غير الله يحفض وصافي .الوقاية الفعالة هي في تجنب دخول اي صيني و اي قادم منها وتتبع حالات الصينيين المقيمين في المغرب راه عندهم مطاعم وشركات هنا .اما حتى دخلوه وهو فيه المرض وعاد نشوفوا مانديروا راه هدا استهتار بسلامة المواطنين ونيت ماعدناش اللبنات الاساسية والمعدات باش نحتويوا هاد الفيروس .
4,"هل الاجراءات الوقائية ستشمل منع الصينيين من دخول التراب الوطني ؟ إذا كان الجواب ""نعم"" فهذه فرصة ذهبية للتخلص من كل ما هو صيني ببلادنا."
0,يجب قطع العلاقات الجوية مع الصين حاليا. كما فعلت ألمانيا والولايات المتحدة الامربكية. يجب عزل القادمون من ببكين ووهان بوحدهم على الأقل أسبوعين. والله المستعان
-8, إذا كانت الوزارة المعنية بالصحة لديها مشاكل في القضاء على بعض الفيروسات واﻻمراض الغير المعدية !! ....فالبلاحرى اﻻستعداد لفيروس كرونا الذي يستلزم مختبرات مطتورة وابتكار ادوية فعالة طاقم طبي مختص ومتمرس!! او انكم ستستعينون بالرقية الشرعية والاعشاب والشعوذة !!
11,الحمد لله بشعورنا ما محتاجينش الخيوط نتكلمو في الواقع ملي معندناش الصحة لاش عندنا وزير و وزارة و العلم لله اشحال ديال الميزانية تتيديو في الشهر و احشومة احنا حافظنا ربي من الأمراض بلاش هذ الوزارة معندنا منديرو بها إلى ابغينا العلاج العطارة موجودين
12,سلام:.الشينوى فيها اكتر من مليار نتع البشار او الدولة موفرلهم كاملين كمامات الانف . واش وزارتنا حتى احنا موفرانا هد الكمامات لي ربعين مليون مغربي !
