vote,comment
3,مجرد هروبهما ..يثير كثير من الأسئلة بغض النظر عن حالة المشفى ..ذالك ان الأمر يتعلق بحالة ولائية معدية فالطبيب المعالج عليه اخضاعهم للحراسة حتى استكمال الفحوصات اللازمة وليس مدهم بورقة ومطالبة بإجراء فحوصات مرض عادي اقسام المستعجلات عندنا كارثية حتى الصابون السائل لا يتوفر الاطقم العاملة من أجل غسل يديها فتكتفي بقليل من المسحوق على ورقة موضوعة جنب المغسل كورشة ميكانيك ثم ان بعض عاملين وعاملات شركات النظافة والحراسة يتجاوزون اختصاصهم للذهاب بعيدا في الاحتكاك بالمرضى وبل في تقديم خدمات علاجية .واغلبهم يفتقر لمعلومات عامة حول أساليب الوقاية والتعقيم .الحل بالنسبة لهذا الفيروس وغيره هو تفعيل مبدا بسيط الوقاية خير من العلاج غلق المطارات في وجه الرحلات القادمة من البلدان الموبوؤءة توقيف السياحة والسفر إلى الصين ..الاحتفاظ باي مشتبه به لمدة اسبوعان ..حتى تظهر النتائج...يجب ان تتصرف الحكومة والمخزن بوطنية عالية وان تستحضر دائما اننا بلد فقير و بمنظومة صحية مهترئة واطر طبية ومختبرات متوسطة وضعيفة الكفاءة ...يجب منع الرحلات الجوية الى الصين..لوقت محدود
4,هروب سائحين صينيين من مستشفى ميدلت خبر مضحك وتافه لأن أي شخص يزور هذا المرفق ولا يعرف أدنى مستوى الخدمات الطبية سوف يبكي حرقة على هذا المرفق بالدات.وخبر الهروب شبهته بخبر غرق السمكة في البحر
4,مما قرائته الأمس في أحد الصحف الصينية،أن السلطات دعت مواطن المكان الذي ظهر منه الفيروس أن يلزموا بيوتهم لمدة 14 اليوم.ومن هذا الخبر يمكن القول أن أربعة عشر يوم هي المدة الاقصى لظهور المرض وبالتالي يجب عزل كل من كان مع المصاب إلى نهاية هذه المدة لتجنب الإنتشار العدوى بين الناس
15,"الوباء لي عندنا في المغرب أصعب من كورونا حنا عندنا وباء ""خورونا"""
5,الحكومة الصينية أعلنت الحرب ضد المسلمين من مواطنيها فعاقبَهُم الله الذي عندهُ جنود السماء و الأرض.
0,انا والله من تق بهذا الخبر لان بمجرد هروب هؤلاء الصينيين انهم مشككون في صحتهم او ان هناك تقصير من طرف المسؤلين بالمشتشفى لاننا نعلم ان ههذه المشتشفيات بالمغرب المنسي لا تقدم اي خدمات في المستوى حثى لو كانت هناك حالات بسيطة فالبلاحرى هذه الامراض انكانت هذه الامراض صحيحة كما تدعي المنظمة العالمية لصحة او انها لعبة من اجل بيع الادوية الجرثومية لان جل دول العالم النامي لا يتوفر على مختبرات من اجل التحقيق في هذه الامراض
3,انا في نظري اقترح عليكم عدم استراد او تصدير كل شئ حتى الكارطون و الاجزهزة اللاليكترونية كل شئ حتى اشعار اخر كذلك الذهاب و اللاياب وشكرا(مثل وباء الطاعون انذاك في عهد النبي صلى الله عليه وسلم.
0,الكلاخ اللي تيقولو ان الله انتقم من الصين بأن نشر فيها فيروس كورونا، الفيروس يهدد بالانتشار في العالم كله، و قد دخل بالفعل لامريكا و فرنسا، احتمال ان يكون وصل لافريقيا بما انه لا يمكن كشفه الا بعد فوات الاوان و تعادي الكثير منه يمكن ان يكون قد وصل الى مجيطك دون علمك. ألا زلت تظن ان الله انتقم من الصين وحدها ام انه يعاقب البشرية جمعاء؟ كفاكم تفكيرا خرافيا و ارتقوا.
104,السيد لعبها بالدين ، الترويج للأفكار العلمانية مغلفة بالدين ليمهد الطريق لنفسه نحو البرلمان ...واحد سلفي خان دينه هل ننتظر منه أمانة إزاء المغاربة ؟
79,إلى إبن المملكة. 1. سوف لا أتطرق للموضوع وإنما لدي سؤال واحد: كيف لسياسي محنك ساهم في تخريب البلاد أن يدلي بشواهد طبية لرئيس مجلس النواب ليستفيد من راتب وتعويضات مجلي النواب وهو بكامل قواه وقع على عقود لحصوله على الجنسية التركية بأموال الشعب؟ أنتظر الجواب.
40,في حالة خروج شباط من البرلمان سواء بالإقالة وبالإستقالة يجب على جمعيات الدفاع عن المال العام رفع دعوى قضائية باسم الشعب لمطالبته باسترجاع الأموال التي أخدها طيلة مدة غيابه عن البرلمان - عام ونصف - أو الحجز هن ممتلكاته لاستخلاص ما أخده بدون موجب حق
11,على قول المصريين*والله صبرت و نلت *خدمته صح امعلم و لكن هيهات ثم هيهات ، تبيع دينك بعرض الدنيا،ابتعد عن الدين و ركز في السياسة و التجارة ،الآن بانت نواياك.هههه
-8,الثوب السلفي لا يلبسه من يستعمل عقله، ومن يلبس الثوب السلفي يحذرونه من استخدام العقل لكي لا ينسلخ من الثوب السلفي، أبو حفص من خريجي المدرسة السلفية لكنه انسلخ منها بتعقله، كثير من المغاربة طلاب المنحة السلفية السعودية بقوا في سلفيتهم لأنهم طبقوا وصية السلفية بعدم الاقتراب من العقل لأن الفكر السلفي لا يصمد أمامه . أبو حفص عند السلفيين هو فنحاص بن باعوراء الإسرائيلي الذي أوتي آيات فانسلخ منها.
-4,شباط وما أدراك ما الكليس ، العبقرية في الحديث في اللقاءات في الإجتماعات النقابية الإجتماعية والسياسية ، البلاغة في إخراج المفردات له أفكار في بداءل واقتراحات في الحياة السياسية النقابية الاقتصاديةوالاجتماعية، رغم ما قيل ويقال عنه شباط عبقري مند صغاره
99,سبب هذا المرض هو أن أغلب الصينيين يأكلون كل ما يتحرك ...فالحمد لله على نعمة المطبخ المغربي ... أو الله يحفضنا من هذا الفيروس الخطير ... خصوصا بعد إسقاط الفيزا على الصينيين ... التهديد يبقى عالي جدا في المغرب و الرابح الأكبر شركات الأدوية كما العادة ...
98,والله العظيم لم أعد أومن بخرافة الدول العظمى أنظرو ماذا فعل بهم أصغر مخلوقات الله لا يرى حتى بالعين المجردة
85,الصينيون يأكلون الصراصير و الثعابين و الفئران وكل شئ لايستطيع أكله انسان عاقل .. فهذه النتيجة امراض فتاكة ..نتمنى عدم دخوله للمغرب فمستشفياتنا كارثية ..ان دخل ستحل كارثة
28,الصحة أصبحت عالمية و لا يحق لأي دولة إهمال الوضع الصحي لسكانها خاصة جانب النظافة. الأمراض الوبائية تندلع دائما في مناطق عيش الفقراء و تتولى وسائل المواصلات نشرها حتى في البلدان الأجنبية الغنية ذات الرعاية الصحية الممتازة
48,الحل الأمثل لهذه البلاد المشؤومة التي لا تقدر حتى على معالجة جرح بسيط فبالأحرى هذا الفيروس الفتاك هو منع جميع الرحلات الآتية من الصين و منع دخول البلاد كل من هو قادم من الصين مباشرة أو بعد مروره ببلاد آخر وتشديد المراقبة داخل المطارات و منع كل الصينيين ولوج البلاد كيفما كان
"-18
 ",صدق او لاتصدق مجرد دعاية لدواء جديد على شاكلة الهواتف الذكية
166,‏الصين بعد أن عزلت مليون مسلم من ‎الايغور في معتقلات التعذيب، اضطرت أن تعزل 40 مليون صيني ومدن وقرى بسبب فيروس ‎كورونا !!.{وما يعلم جنود ربك إلا هو}. لا تظن أن دعاء المظلوم يذهب ادراج الرياح، بل يقول الله وعزتي وجلالي لانصرنك ولو بعد حين.
36,اللهم احفظ بلدنا الضعيف بالامكانيات انه على كل شيء قدير. يجب على الحكومة الاجتماع ووضع خطة عمل للوقاية من هذا الوباء
29,، باشرت سلطات المدينة بناء مستشفيين يضمّ كل واحد منهما ألف سرير، ويُتوقع أن تنتهي أعمال البناء في وقت قياسي، أقلّ من أسبوعين.
11,و تبقى الصين دولة من دول العالم الثالث مهما وصلت من تقدم...
15,المهم يجب التكلم عن الشعب الصيني باحترام لانه تطور في وقت وجيز وغزى العالم اقتصاديا ولم يفعل كالاوروبيين والأمريكان الذي نهب ومازال ينهب ينهب ثروات أفريقيا والخليج وأظن ان سبب الوباء هو امريكا من اجل وقف زحف الثنين الصيني وضرب الاقتصاد
7,اسطورة الفيروسات مازالت مستمرة، في كل مرة يختارون وقتا مناسبا لفيروس معين، لماذا لا تتداخل أحداث دولية مع زمن ظهور هذه الفيروسات؟ مثلا ، لماذا هذا الفيروس لم يتحدثوا عنه أثناء الازمة الامريكية الايرانية أو قبل ذلك؟ إذا لاحظتم، دائما قصة الفيروسات هذه تختار وقتا تكون فيه هي الخبر الأول، من الجمرة الجبيثة وسارس، ثم الحمى القلاعية وو..النظام الصيني أراد أن يستجمع قوته أكثر منذ الصراع بين عملاق الهواتف الصيني وترامب ثم الاحساس بالإنزواء في الركن بأزمة الإيگور وتداعياته على الاقتصاد الصيني. ما ستفعله الصين الآن هو التقوقع وبعد مدة سنسمع بالقضاء على الفيروس كلية. إنها مجرد ألاعيب ماكرة
6,هناك لمسة يد....اشم رائحة امريكا وراء كل هدا لايقاف الزحف الصيني.
2,اتمنا ان تمنع الرحلات من وإلى الصين في الوقت الحالي ،لا يستطيع موضفو المطارات من تحديد المرض،فهل موظفو المطارات يستطيعون تحديد الممنوعات والوتاءق المزورة للسفر وحتى هاد الفيروس في بعض دقائق، لا نريد سياحة من سياح يهددون صحة المواطنين ،الله يخفض ملكنا ويحفض شعبنا المغربي والمغاربة أينما كانو الله يشفي الجميع شكرا هيسبريس
0,عندنا الدواء دياله ماتخممش آعشيري..كيفما كان كاس ديال المخينزة مع الثومة بالعسل و الزيت الزيتون.. !!
11,و ماذا عن السلع الصينية التي التي لا تنقطع سفنها عن الموانى ء المغربية اليس منها اي خطر
2,هذا الفيروس كباقي الفيروسات لا تعترف باي حدود . وسنوف نرى ماذا سوف تقولون عندما تدق ابواب احد منكم لا قدر الله. المغرب بالامس القريب اجتاحه وباء تلو الوباء كادو ان يبيدو سكانه بالكامل وفعلا ابيد قرى كامله. قرون وقرون وسكان المغرب لا يرتفع عدده بل احيانا يتراجع بسبب الاوبئه والأمراض الفتاكه. هذا بالرغم من الولادات الكثيفه. ولهاذا كله لا يجب ان نتشفى لما يحدث في الصين. اما نسب هذه الكارثه لجنود الله فهو نوع من البلاده والغباء.
1,تذكرني طوابير هاته الأحداث التي تقع في الصين بالطوابير في الجزائرمن اجل شكارة الحليب والزيت والدقيق تقريبا نفس الشيء ففي بعض الاحيان يمكنك الانتظار في طوابير لغاية يومين
0,بالنسبة للكثافة السكانية في المغرب انخفضت او ظلت ثابتة فهي بفعل النهج الذي اتخد في الثمانينات والتسعينات وهو تحديد النسل بمعنى قبل ذلك كانت الاسرة الواحدة تتكون قبل 1980 من خمسة أبناء ومافوق مع الابوين لكن بعدها عند تحديد النسل انخفض عدد الأبناء في الاسرة إلى 2 او 3 فهذا هو السبب الذي جعل المغرب عدد كثافته السكانية ثابتة في السنوات الاخيرة وليس له علاقة بالاوبئة.
4,"لا أفهم لماذا بعض المعلقين هنا يستخدمون معاناة الآخرين لتمرير خطاباتهم الدينية والتشفي في الآخرين بطريقة توضح لك مدى حقارة هؤلاء.الفيروسات تحدث .. فقط قبل سنوات ظهر مرض كورونا في بلاد الحرمين , بسبب تربية الإبل.هل نقول أن الله غضب على السعودية؟ علميا الفيروسات من هذا النوع, ليس لها علاقة بما تأكله او لا تاكله.. الفيروسات تنتج نتيجة لحدوث طفرة في احد الفيروسات التي تصيب احد انواع الحيوان .. في هذه الحالة الجديدة : نوع من الثعابين , بينما في حالة السعودية سنة 2013 : كانت الابل.من فضلكم, ضعوا عقولا في تلك الرؤوس, قبل التشفي في الآخرين. لأن المنطق الذي تستخدمونه في التشفي في معاناة شخص صيني كافر , لا تستخدمونه عندما يحدث نفس الشيء لمسلم في السعودية .المصائب تحدث في أي مكان , لا تحاولوا عقلنتها بشكل يتناسب مع معتقداتكم الدينية.واتركوا التفسيرات الفارغة جانبا .. الأمراض والمصائب تحدث في كل مكان. ارتقوا فالقاع مزدحم ...تحياتي."
1,٢٤انا لا اتحدث على الثمانيات يا سيدي الفاضل. هذا سهل الفهم .انا اتحدث ما قبل ذالك بكثير اي قبل تقدم الطب العلمي واكتشاف المضادات الحيويه كالبنيسيل مثلا . والتغلب عن المجاعات. وتحسين النظافه للمواطنين المغاربه الخ...فقرن من الزمان او اثنين لا يعني شيئ اذا نضرنا الى عمر البشريه ولذا قلت بالامس القريب. اقرأ التاريخ فسوف ترى كيف كانت الاوبئه كالطاعون مثلا كانت تبيد مناطق بأكملها في المغرب الى حد تجعل عدد السكان في البلاد تتقهر الى الوراء.الانفجار الديموغرافي في المغرب الذي نشهده الآن بدايته كان السبعينات فقط وذااك بفضل العوامل التي ذكرتها سابقا. وليس لغياب جنود من السماء كما ذكر بعض الاخوه .والسلام.
-20,منذ زيارة الملك لبيكين و توقيع اتفاق يسمح للصينيين بدخول المغرب بدون تأشيرة لم ارتح لهذا القرار كنت أعرف أن المغرب لن يجني إلا المشاكل، على المغرب سحب السفير المغربي وباقي القناصل من الصين و إرجاع المغاربة من هناك و طرد الصينيين من المغرب حتى تعود المياه الى مجاريها و تحل هذا المشكل. في نفس السياق أعتقد أنها ليست سوى خطة خبيثة من الصين لمنع دخول الأجانب وخصوصا الأمريكيين الى أراضيها في خضم إستمرار الأزمة بين واشنطن و بيكين التي انتقلت من البعد الإقتصادي الى البعد السياسي
23,الصين ذات المساحة الكبيرة والساكنة الضخمة بمجرد ظهور اول حالة من ذاك المرض أعلنت حالة الطوارئ الصحية في كل ارجاء البلاد. فهذه هي الدولة التي تحترم شعبها. أما عندنا لما ظهرت أمراض في أضحية عيد ما قبل الأخير ظهر الوزير وقال لا يوجد مرض وإنما المغاربة لم يعرفوا سلخ اضاحيهم.. فماذا تنتظر من هؤلاء في الحالات الخطيرة كما في الصين؟؟؟
0,زويينة هادي نهار طلقة الخطوط الملكية خط بكين نهار بان فيروس كورونا وليّني نحس هدا، المغرب زاد مشكل آخر دبا ما تسمع غير خليّة فالصين و خليّة فالمطار، ها كورونا هنا الا راها لهيه هههه
47,لاتكفي المراقبة في المطارات والموانئ لأن المصاب بالفيروس قد يكون تناول الأسبرين مما ينقص من حرارة جسمه ،أو لا تظهرعليه الأعراض إلا بعد العبورداخل البلد ونقله للعدوى لكل من ٱقترب منه .أويكون سافرعبرمطارات متعددة ولم يسافرمن الصين في ٱتجاه المغرب عبرخط مباشر.فالرقابة تلزم وزارة الصحة أن تقوم بإعلان لكل من كان سافرإلى الصين و به اعراض هذا الفيروس أن يتصل بالخلية الصحية عبر رقم هاتف خاص وأن لا يدهب للمستشفى والمستعجلات أو الطبيب مخافة من ٱنتشارالعدوى،بل الفرقة الطبية المتخصصة هي التي ستأتي إلى مكان تواجده .
59,والشناوة الذين غزوا الدار البيضاء و يسافرون و يتوافدون من الصين ؟ ماذا عنهم؟ هل من تدابير وقائية؟ اذا اصيبت قرية بوباء يمنع اهلها من النتقال الى الخارج كي لا ينقلوا العدوى ! ماشي نراقبوهم في المطار !!!بعد فوات الاوان!!!!!!
10,Les autorités chinoises s'apprêtent a mettre sous confinement la ville de Shantou (5 millions d'habitants).تستعد السلطات الصينية لوضع مدينة شانتو (5 ملايين نسمة) في الحبس.
13,"الفيروس المركب ""كرونا"" والذي تسرب من أحد المختبرات البيولوجية ...يطرق أبواب شمال إفريقيا ...نعم يمكن أن يتسلل وينتقل إلى دول شمال إفريقيا في أية لحظة لاسيما إذا وضعنا في الحسبان أن العديد من مواطني شمال افريقيا من جزاىءريين ومغاربة وموريتانيين يترددون يوميا عبر مطارات الصين على بلدانهم الاصلية بل يتنقلون داخل الفضاء المغاربي عبر المطارات ايضا وبرا احيانا.... آلاف الزوار المغاربيين يترددون يوميا على هذه المنافذ الجوية والبرية ...ومن غير المستبعد جدا أن يتم نقله عبرهم إلى شمال إفريقيا ...والتذكير فإن الرئيس أقر صراحة بأن ""الخطر داهم"" وعالي جدا وذلك بعد تلكؤ دام شهرين وفرض سياسة التعتيم حتى ويتلقى الاقتصاد الصيني ضربة قاصمة ...والضحايا بآلاف عكس ما صرح به(41) نعم بالآلاف في بلد تبلغ ساكنته مليار و500مليون وزواره يوميا بالملايين من جميع الدول....فرغم سياسة التستر والتعتيم حفاظا على المصالح التجارية والاقتصاد واستمرارية التصدير والإنتاج التي تنتهجها الحكومة الصينية مدة شهرين اقرت مؤخرا بعدما كان الضحايا بالآلاف..."
25,طبعا الوقاية خير من العلاج وللأسف فالمغرب لا يتوفر على المستشفيات الخاصة لمواجهة هذا الوباء نطلب من الله السلامة والحفظ من هذه الأمراض الفتاكة.
40,هاد الشعب محفوظ بالعناية الالاهية ، أما وزارة الصحة مقدرت حتى على الأمراض العادية مبقى غير تداوي كورونا ولا غيرها . كولو البصلة والثومة وما تعولو حتى على شي مسؤول ، راه مخبيين حتى يفوت المشكل .
6,يجب على وزارة الصحة أن تاخد كل التدابير والاحتياطات اللازمة من حملات تحسيسية وطرق التعامل والوقاية من هدا الفيروس وتوفير المضادات الحيوية اللازمة وإنشاء خلايا تتبع في كل الجهات وتشديد المراقبة على المعابر الجوية والبرية والبحرية بتنسيق مع مختلف القطاعات الوزارية الأخرى مع فتح خطوط اتصالات مباشرة للتبليغ ومحاصرة الحالات في حال اكتشافها.نرجو السلامة والصحة والعافية للجميع ولكن تبقى الوقاية الاستباقية خير من العلاج.
15,اتمنى ان تاخد وزارة الصحة الامر بجدية تامة لان وضع المغرب هش جدا بالنسبة للأوبئة بالمنظومة الصحية هشة وضعيفة جدا حتى امام مرض كالزكام .وثانيها انتشار الأمية وثقافة النظافة فيعتبر غسل الايدي رفاهية في كثير من المناطق وانتشار وساىل مواصلات بداىية كالطاكسيات المزدحمة نوع مرسيدس ..وانتشار البصق على الارض ..ووو...نتمنى نشرة صحية تؤطرها وزارة الصحة للتنبيه والتوعية للممارسات الخاطئة ..في المجتمع ..
17,السلام عليكم هذا انتقام من الله للمسلمين الذين قتلوا في الصين ولا احد تكلم الا جبروة الخالق
8,تخويف شعوب لإستنزاف مواردها وبيع أدوية لوبيات الآدوية تلعب هذه اللعبة لضغط على حكومات أخطر لوبي بعد كهنة الدين هو لوبي أدوية الذين يخوفون الناس والشعوب الآولى من الله وثاني من أوبئة
10,يجب اجلاء المغاربة المقيمين بالصين سلامتهم يجب ان تشكل بعد وطني للدولة بالإضافة الى تشديد المراقبة في المطارات و الموانئ المغربية حتى لا يتسرب هذا الفيروس داخل البلاد لو قدر الله و تسرب للداخل سيفتك بالمواطنين الأبرياء في ظل ضعف الإمكانيات و المنظومة الطبية بالمغرب
18,غيرمقبول لأنه غيرمعقول !التعريفة الخاصة بالفحص لدى أطباء القطاع العام ارتفعت من 80 إلى 150 درهما، وفي القطاع الخاص ارتفعت من 150 درهما الى 250 درهم، إلى جانب ارتفاع تعريفات الطب النفسي من 190 درهما الى 290 درهم، وارتفاع الفحص بالصدى وفحوصات القلب الى 350 درهما.
